{
  "schema_version": 1,
  "record_type": "aurora_epistemic_trace",
  "trace_id": "asm.trace.fixture-001.turn-07",
  "episode_id": "asm.episode.fixture-001.turn-07",
  "authority": "synthetic_fixture",
  "created_at": "2026-08-01T00:00:00Z",
  "producer": {
    "component": "qsfe-fixture-adapter",
    "version": "0.1.0",
    "repository_revision": "b83b968028a3888a869ca047016e28e39c3ec46a",
    "seed": 2201
  },
  "network": {
    "network_hash": "sha256:bbbbbbbbbbbbbbbbbbbbbbbbbbbbbbbbbbbbbbbbbbbbbbbbbbbbbbbbbbbbbbbb",
    "topology": "two-cell-bridge",
    "agent_count": 8,
    "cell_size": 4
  },
  "observation_mask": {
    "mask_id": "mask-partial-02",
    "evidence_refs": [
      "asm.synthetic.evidence.power-margin-01"
    ],
    "hidden_state_paths": [
      "/station/power_margin"
    ]
  },
  "storage": {
    "granularity": "aggregate_only"
  },
  "snapshots": [
    {
      "round": 0,
      "aggregate_beliefs": [
        {
          "group_id": "operations",
          "member_count": 4,
          "belief_mean": 0.61,
          "belief_variance": 0.04,
          "confidence_mean": 0.58
        },
        {
          "group_id": "engineering",
          "member_count": 4,
          "belief_mean": 0.66,
          "belief_variance": 0.03,
          "confidence_mean": 0.63
        }
      ]
    },
    {
      "round": 1,
      "aggregate_beliefs": [
        {
          "group_id": "operations",
          "member_count": 4,
          "belief_mean": 0.7,
          "belief_variance": 0.03,
          "confidence_mean": 0.67
        },
        {
          "group_id": "engineering",
          "member_count": 4,
          "belief_mean": 0.74,
          "belief_variance": 0.02,
          "confidence_mean": 0.71
        }
      ]
    }
  ],
  "dynamics": {
    "dissent_score": 0.18,
    "echo_risk": 0.12,
    "polarization_score": 0.09
  },
  "forecast": {
    "outcomes": [
      {
        "label": "readiness_maintained",
        "probability": 0.72
      },
      {
        "label": "readiness_degraded",
        "probability": 0.28
      }
    ],
    "confidence_components": {
      "evidence_quality": 0.64,
      "network_agreement": 0.73,
      "visibility": 0.55
    }
  },
  "validation": {
    "schema_valid": true,
    "replay_classification": "byte_stable",
    "validator_refs": [
      "fixture-validator:1"
    ]
  },
  "promotion": {
    "eligible": false,
    "reason": "Synthetic conformance fixture; never canon-eligible."
  }
}
